{
  "contractVersion": 1,
  "correlation": {
    "requestId": "req-0003",
    "userId": "user-0001"
  },
  "toolCallId": "call-0002",
  "toolName": "system.echo",
  "arguments": {
    "message": "Look up my saved preferences.",
    "context": {
      "locale": "en-US",
      "clientVersion": "0.1.0"
    },
    "credentialHandle": "vault:acct-credential:8f21"
  }
}
